{
  "authority": {
    "projectId": "prj_demo",
    "authorityIncarnation": "aaaaaaaaaaaaaaaaaaaaaaaaaaaaaaaaaaaaaaaaaaaaaaaaaaaaaaaaaaaaaaaa",
    "coordinatorEpoch": 1,
    "resourceKey": "integration:prj_demo",
    "fencingToken": 1,
    "ownerId": "owner_demo"
  },
  "attemptId": "id_demo",
  "launchIdentity": "aaaaaaaaaaaaaaaaaaaaaaaaaaaaaaaaaaaaaaaaaaaaaaaaaaaaaaaaaaaaaaaa",
  "reportId": "id_demo",
  "reportKind": "started",
  "observedAtMs": 0,
  "process": {
    "supervisorId": "id_demo",
    "launchIdentity": "aaaaaaaaaaaaaaaaaaaaaaaaaaaaaaaaaaaaaaaaaaaaaaaaaaaaaaaaaaaaaaaa",
    "pid": 1,
    "startIdentity": "aaaaaaaaaaaaaaaaaaaaaaaaaaaaaaaaaaaaaaaaaaaaaaaaaaaaaaaaaaaaaaaa",
    "executableHash": "aaaaaaaaaaaaaaaaaaaaaaaaaaaaaaaaaaaaaaaaaaaaaaaaaaaaaaaaaaaaaaaa",
    "descendantScopeHash": "aaaaaaaaaaaaaaaaaaaaaaaaaaaaaaaaaaaaaaaaaaaaaaaaaaaaaaaaaaaaaaaa"
  },
  "writerTreeTerminated": false,
  "terminationReceiptHash": null
}
